p1.key,p1.hotel_name,p1.city_name,p1.country_code,p1.hotel_address,p1.star_rating,p1.postal_code,p2.key,p2.hotel_name,p2.city_name,p2.country_code,p2.hotel_address,p2.star_rating,p2.postal_code
449300D7903A2004FB26A2D86E232CFA,@Samui Haus Resort,Samui,TH,"58/15 Moo 2, Racha Ferry road, Lipa noi",3.5,84140,E337C572F825B72A43A74C8CD358A0BD,@Samui Haus,Lipa Noi,TH,"58/15 Moo 2, Koh Samui, Surat Thani",3,84140
386043750EEB262E3B1895DD28E5E45F,Oyo Rooms - Cyber City Oakwood,New Delhi and NCR,IN,P-5/1 Dlf Phase 2,2,122002,7C267C54C7B771A944F2EDA42D4B3A2D,OYO Rooms Cyber City Oakwood,Gurgaon,IN,"P-5/1 ,DLF Phase - 2",3,122002
55DF933A19EC813D7892675D7B2D1B94,7 Days Inn Emei Haochijie Branch,Mount Emei,CN,"No.2, Dongxin Road",2,,CA2010DC8F2DB2F1C7DB7028E50A6387,7Days Inn Mt. Emei,Emeishan,CN,2 Dongxin Road,2,614200
95FA8640CEC1243CAC49C4F50710440C,Zio Resort,Yangyang-gun,KR,"121-2 Junggwangjeong-ri, Hyeonbuk-myeon",2,215-833,AAFD3F6CB6F9C8F5E5A933214F65FCC7,Zio Resort,Yangyang,KR,"121-2, Junggwangjeong-ri, Hyeonbuk-myeon",2,215-833
ACA467BD93827F6001DDD139E7AB4299,Atlantis Condo Resort Pattaya By ACC,Pattaya,TH,495/32 2floor Nongprue Banglamung,2,20150,845F505251CF1D83547D4669A44D17A4,Atlantis Condo Resort Pattaya by Kulisara,Jomtien Beach,TH,"495/19, Moo 12, Jomtien Sai 2, Tambol Nongprue, Banglamung",0,20250
89810FDC33D5AFE15C359561BCB6AE26,Hanting Hotel Shenzhen Sea World Merchants Road Branch,Shenzhen,CN,"No.63,Zhaoshang Road,Nanshan District",2,,253FD0141D30F420FC49BEFF0969313B,Hanting Express Shenzhen Hai Shang Shi Jie Zhao Shang Road Branch,Shenzhen,CN," No.63, Zhao Shang Road, Nanshan District, Shenzhen",2,518067
7DEE2D036FDCF77F4E5ACD62C3B79EF7,Villa Anema,Bali,ID,Jalan Kuwum Gang Anggarek no 22,4,80361,E0E8E76F210101957CB4632FD539FA00,Villa Anema,Canggu,ID,"Jl. Kuwum, Gang Anggrek No. 22",4,80361
4EB7D047530D84B8229DC171B93AFF8A,NobleDEN Hotel,New York (NY),US,"196 Grand Street, New York, NY 10013",4,10013,F45F15AD97EBD29D7330782981286923,NobleDEN Hotel,New York,US,196 Grand Street,4,10013
7EE7A85CB956C582DB2EA59C7905915C,D Circle Hotel,Manila,PH,2063 M.H. Del Pilar St.,3,,F8D173B425FBA55B7302D4E2CA08F060,D Circle Hotel,Manila,PH,"2063 M. H. Del Pilar Street, Malate",3,1004
A3ADC26A4D9C19DD1278B6EE54CC4134,Tsing House Olympic Center,Qingdao,CN,"No.1 Zengcheng, Jinhai Square, Building 8, No.3 Unit, Room 102",2,266071,3F8AE8463634C3A50427A052339BC732,Tsing House Olympic Sailing Centre,Qingdao,CN,"Room 102, Unit 3, Building 8, Jinhai Square, No. 1 Zengcheng Road",0,266071
C057B0812B3E4E25E1F155A811AB29E1,Ripetta Harbor Suite,Rome,IT,"Via di Ripetta, 12",0,186,37C44431392FA68C6014B03A7313C104,Ripetta Harbor Suite,Rome,IT,Via di Ripetta 12,0,186
74795920326B2B2C9BCD38F22E407327,Green Tree Inn Zibo Liuquan Road Wal-mart Square Express Hotel,Zibo,CN,"No.71, Liuquan Road, Zhangdian District",2,255000,28AF09E678BB34F6FF668206A586E248,GreenTree Inn ZiBo LiuQuan Road Wal-Mart Square Express Hotel,Zibo,CN,"No.71, Liuquan Road, Zhangdian District",2,255302
1A1E6DAF486ECBEB79F26AF82BEB14FF,GreenTree Inn Eastern Yancheng Administration Center Hotel,Yancheng,CN,No.188 Yingbin Nan Road,4,,282ABA033C83B7BB920F69D5FCE69C12,GreenTree Eastern JiangSu Yancheng Administration Center Hotel,Yancheng,CN,"No.188, Yingbin South Road, Chengnan New District",4,224000
3C89551E3021D4D8E449DC5DCE671FCA,Pingouinvillas,Mauritius Island,MU,"94A,Daurades Road",3,,1E5B5DB2D732EBF0417B131BE0C5124C,Pingouinvillas,Blue Bay,MU,"94a, Daurade Road Blue Bay",0,
595610F9AB71A4A32E5259CA2098F8A7,6 The Apartment,Cape Town,ZA,"12 Marine Road, Three Anchor Bay",3.5,8005,41CA061F0B8DDE106A9C51C3D64DF913,6 The Apartment,Cape Town,ZA,12 Marine Road,0,8005
66A354574128E72C8ED35B02AEAFA573,Iberotel Makadi Beach,Hurghada,EG,"Madinat Makadi, Safaga Road, P.O. Box 387, Red Sea,",5,,CCDA428C489A0D3BF7A1B8C432B535CF,Iberotel Makadi Beach,Hurghada,EG,Makadi Bay - 34 Km Hurghada - Safaga Road,5,
BB1F03059E82FFD9D6758076B690406C,Xishuangbanna Boliheng Youth Hostel,Xishuangbanna,CN,300 meters east of passenger station,2,666100,99A4000BD7B4E6EFF317A282A8800AD0,Boliheng International Hostel,Jinghong,CN,300 East to Jinghong South Bus Station,0,666100
9EB15E490728A3954F889D8188BFC78C,Homeinns Plus Wangda Subway Station Suzhou,Suzhou,CN,No.3333 Renmin North Road,3,215002,FB984B3B668374671382AAB89FB6D0ED,Home Inn Plus Suzhou Wanda Plaza Railway Station,Suzhou,CN,No.3333 North Renmin Road,3,215000
48DDC5231897AC3BADF5896915F6AB79,Budi house & food station,Bandung,ID,Jalan Budhi,1,40175,E9B64AB32CC5194C76C6EF237F924C97,Budi House & Food Station,Bandung,ID,Jalan Budi No. 27/29,0,40175
ADA86D62C71F5012DF4D11FCBC456EB2,Kim Haus Loft,Penang,MY,"No 9 & 11, Lebuh Campbell",2,10100,F45FDC1FABE5CD39008809A308C157B4,Kim Haus Loft,George Town,MY,"No.9 & 11, Campbell Street, Lebuh Carnarvon, Penang",0,10450
CBE8E541B7A7489AB47AA4C19582F4AE,Garden Guesthouse,Thakhek,LA,Ban Paksimung,1.5,,9A7A148CE4100B08D13B25626C7B57C5,Thongchaleaune Guesthouse,Ban Lao,LA,Ban pakdong,0,1000
59F0AEC2A7529C74AB888F1EB0350413,Vessel Hotel Higashi-Hiroshima,Hiroshima,JP,2-6-36 Minaga,4,739-0026,7518F1F4FE0D08FEFE96EF5128C407F9,Vessel Hotel Higashi Hiroshima,Higashihiroshima,JP,Minaga 2-6-36,3,739-0026
413F0D03BF8F350D2F369B05A10B71DA,The Elegant Lodge,Pretoria,ZA,"83 23rd Street, Menlo Park",4,102,6E93A6E8859ADB32F321BC183A03C5D8,The Elegant Lodge Menlo Park,Pretoria,ZA,"83, 23 rd Street, Menlo Park",4,102
19AA6C6FB4BA9FCF39E893FF1FD5B5BD,Millennium Hotel & Resort Manuels Taupo,Taupo,NZ,243 Lake Terrace,4.5,,01D6BA4C06BEA1C91A3C231DB9D135D9,Millennium Hotel & Resort Manuels Taupo,Taupo,NZ,243 Lake Terrace,4.5,3330
9B104CDAF597CD9103A1D05D785ABC8F,Hotel Juliana,Tuguegarao City,PH,"2-B Blumentritt Street Corner Gonzaga, Centro 04",2,,FAE2ECD99C0059F4D911526AC2755F5F,Hotel Juliana,Tuguegarao City,PH,"2-B Blumentritt Street, Centro 04",1,3500
DDD8C274ABDA584E1A70B88E2F6FB657,Madrid Hostel,Taichung,TW,"No.9-11, Nanzi Ln., Sec. 2, Xitun Rd.,",3,407,B43C2349C39DF5ABF41C48D5E839C99D,Madrid Hostel,Xitun,TW,"No. 9-11, Nanzi Lane, Section 2, Xitun Road",0,407
80A9EFD37C62CBDEE2351192983A43D6,Jianguo Hotel,Beijing,CN,No.5 Jianguomenwai Avenue Chaoyang District,4,,FE38721F4B3A652508161922C8B686D9,Jianguo Hotel,Beijing,CN,No.5 Jianguo Men Wai Da Jie,4,100020
8A9FEBF74FAD9C8C57C285BE7C85E979,Boracay Balcony Inn,Boracay Island,PH,"Road 1-A, Bulabog, Brgy. Balabag",1.5,5608,26FC2FCC4DE764FCAEB310C65BEEA03A,Boracay Balcony Inn,Boracay,PH,"Bulabog Rd. 1-A, Brgy. Balabag, Boracay Island, Malay, Aklan",2,5608
236299DCF26AD1A0EBB8EBEE5655088D,Poonsap Apartment Koh Lanta,Koh Lanta,TH,"571 Moo 3, Saladan, Krabi",2,81150,8BB6A2A6566C450EFD0E9F1ED40AFB06,Poonsap Apartment,Ko Lanta,TH,"571 Moo 3, Saladan, Koh Lanta, Pra Ae Beach, , Krabi, Thailand, 81150",2,81150
EA051928CAF84D26CF38A94771DA2A95,Campanile Paris Est - Bobigny,Paris,FR,"304, avenue Paul Vaillant Couturier",3,93000,FD2E7D73B37AEE84474900A02C88ED0B,Campanile Paris Est Bobigny,Bobigny,FR,304 Avenue Paul-Vaillant-Couturier,3,93000
DD2D7A1520C5543DF5D31C012634CE94,Millenia Suites Ortigas,Manila,PH,8001 Saint Jose Maria Escriva Drive,3.5,1600,59242F3680D96E7176C2011D181CA731,Goldland Millenia Suites,Manila,PH,"8001 Saint Jose Escriva Drive, Ortigas Center",3,1605
44A56E7BB950F26ACDE1BD0FA7FB5727,Mercure Manado Tateli Beach Resort,Manado,ID,"Jl. Raya Tanawangko, Desa Tateli Kecamatan Pineleng Kabupaten Minahasa Sulawesi Utara",4,,B46DC4A276F8A619426BBBBBA9E990C7,Mercure Manado Tateli Beach Resort,Manado,ID,Jalan Raya Tanawangko,4,95017
80C02A7BEFB39BCFC1383B12F26F2BFB,Eco Spa Village,Phan Thiet,VN,"719 Road, Tan Thanh Village, Ham Thuan Nam",3,84 62,C95E4E1BEF32282C25E19FA8FE6E5406,Eco Spa Village,Ke Ga,VN,"Ke Ga Hamlet, Tan Thanh, Ham Thuan Nam District, Binh Thuan Province",3,
B8797A0F5347256BCD2D739ABD31D450,Citrus Hikkaduwa,Hikkaduwa,LK,"400, Galle Road",3,80240,851001C4D21CDAD76B276376B87FEC0D,Citrus Hikkaduwa,Hikkaduwa,LK,400 Galle Road,4,80240
6D0932A1B45D687528C50A461EF35A44,Murray Gardens Country Cottages & Motel,Stanthorpe,AU,10 Pancor Road,3,4380,9D71D866EF422B9DE6A60289721C334E,Murray Gardens Cottages & Motel,Stanthorpe,AU,10 Pancor Road,3,4380
338C5458FADF5E13BDDFCB4819942D15,Hanoi New Century Hotel,Hanoi,VN,"12B Hang Manh Street, Hoan Kiem District",2,,D8ACB0CFC81A741B09E538DF3C66BB2D,New Century Hotel,Hanoi,VN,12B Hang Manh,0,
18803F82D91709039A015C3253E68CEB,Oaks On Market Hotel,Melbourne,AU,60 Market Street,4,3000,80EE6B4E99B7282CCB7D6688AF1B6EDC,Oaks On Market,Melbourne,AU,60 Market Street,4.5,3000
4D24B557CA15F2CB6DC7C40B1991365D,Red Planet Angeles City,Angeles / Clark,PH,"Don Juico Avenue, Malabanias",3,,A4751B30E9D3E324D73E5B8C68EB9537,Red Planet Angeles City,Angeles,PH,"Don Juico Avenue, Malabanias, Angeles City, Pampanga, Philippines ",2,2009
145F753DFB01F558BBCB5D21FD809254,HF Fenix Porto Hotel,Porto,PT,Goncalo Sampaio Street 282,4,4150-365,FDE68DEDAEC43289F5F7D9C8FA7FF53D,HF Fenix Porto,Porto,PT,"Rua Gonçalo Sampaio, 282",4,4150-365
D8042C9EA8726B096DF949CE6F747D7A,Mango Hotels - Bangalore – Koramangala II,Bangalore,IN,"No. 426,8th Main, 4th Block Koramangala",3,560034,1ACB0C518750F9534223F3F078074121,"Mango Hotels, Bangalore- Koramangala II",Bangalore,IN,"Survey No 426, 8th Main 4th Block, Kormangala ",3,560034
5B54084CF4EF6D8495B641C29D742544,Americas Best Value Inn Abingdon,Abingdon (VA),US,887 Empire Drive,0,,F88A75DC8270D52CB848184E204D46E7,Americas Best Value Inn Abingdon,Abingdon,US,887 Empire Drive ,2,24210
8F4EA70A479C391422F80A0BBE288E01,Hanoi Culture Hostel,Hanoi,VN,"28 Bat su Street, Hoan Kiem District",1,,09556D1B7D6CEBBF817F08D79C323FF9,Hanoi Culture Hostel,Hanoi,VN,28 Bat Su ,2,
79506308EF4D4CDFEA1383BCE14589A2,Clarks Exotica Resort and Spa,Bangalore,IN,"Swiss Town , Hollywood Junction, Sadahalli Post, Devanahalli Road ,",5,562110,FCFB7573A7E9B11702990BB6A6E83732,Clarks Exotica Resort & Spa,Devanhalli,IN,"Swiss Town, Hollywood JN, Sadahalli PO, Devenahalli Road",5,562110
87CED859585358726C68B449760C5F1F,Apartment Corso Vittorio Emanuele I Roma,Rome,IT,.,0,186,00BE57FBD4885B6B86E84A5FE150E6F4,Apartment Corso Vittorio Emanuele I Roma,Rome,IT, ,0,186
3DE63B90CC366F26104BDFE49ABE0CFC,Hotel Sevastopol Modern,Moscow,RU,"Bolshaya Yushunskaya ulitsa,1A",3,117303,43E6F702E6CFF467E8E58A2DEF2E7FB9,Sevastopol Modern,Moscow,RU,Ulitsa Bolshaya Yushunskaya 1 A Bld.2,3,117303
50BDA6C4FF575F1217FD4087A7677399,Econo Lodge,Belton (MO),US,222 Peculiar Dr.,2,64012,30B8881309B43A1B861244174EC46949,Econo Lodge Belton - Kansas City South,Belton,US,222 Peculiar Drive,2,64012
017296058FE175E4354F2DFF111185F7,Comfort Inn,Toms River (NJ),US,2215 Route 37 East,2,8753,D9ECB7A0607F3E752CBEE18C70BCAA92,Comfort Inn Toms River,Toms River,US,2215 Route 37 East,3,8753
AD8B3EE7A20DF4EA6E6BEE1CB74D6D15,Sturt Motel,Broken Hill,AU,153 Rakow Street,3.5,2880,A3E09206EF18E93D4094CB8AA01F4701,Sturt Motel,Broken Hill,AU,153 Rakow street,3.5,2880
777E9316C298BB95E60E802C2A82E55E,Wrangler Inn Mobridge,Mobridge (SD),US,820 West Grand Crossing,2,,C6AFEF7FE23D278DA1E9B9A2C1DB6880,Wrangler Inn Mobridge,Mobridge,US,820 West Grand Crossing,2,57601
02005E51CC38D653A2C40695284636B2,Sasebo Dai-Ichi Hotel,Nagasaki,JP,4-4 Miuracho,3,857-0863,8FF8B955B4CC219489EDFA94FD18A06F,Sasebo Daiichi Hotel,Sasebo,JP,Miura 4-4,3,857-0863
4CE91179D2642835A081768BE5B422AF,The Donatello,San Francisco (CA),US,501 Post Street,4,94102,4210187346DC0768537A080298C72DBB,The Donatello Hotel,San Francisco,US,501 Post Street,4,94102
5BA01C0E82CD96577309302FAF900A0D,Comfort Inn Near Vail Beaver Creek Avon,Avon (CO),US,0161 W. Beaver Creek Blvd.,3,81620,BCBCB67CE0D6AD924EABB9BE6EE96F51,Comfort Inn Vail Beaver Creek,Avon,US,0161 West Beaver Creek Boulevard,2,81620
B0A2242DBED17548AE57969321636E61,Econo Lodge Inn and Suites,Gilbertsville,US,2184 US Highway 62,3.5,42044,709A889E99102463A9E538EC08C5244A,Econo Lodge Inn & Suites Gilbertsville,Gilbertsville,US,2184 US Highway 62,2,42044
69736CCCE4B6429FBB29DC791DE35767,Hotel Le Village,Winnenden,DE,Max Eyth Street 41,3,71364,F24619A7D570E5707D22C2F276608CD7,Hotel Le Village,Winnenden,DE,Max-Eyth-Strasse 41,3,71364
7AF0613494ADA22CBEFAD59780D50BAA,Hotel Palms Residency,Nasik,IN,Adgaon naka near Aurangabad naka panchavati nasik,1.5,422003,7D8219446BC8AB2B1B4FD7ECCCCB252A,Hotel Palms Residency,Nashik,IN,"New Adgaon Naka, Near Aurangabad Naka, Panchwati",0,422003
A487B081BAB7C33D3736DC18C6C55F35,Manichan Guesthouse,Luang Prabang,LA,"Ban Pakham, Unit 4/143, Luang Prabang, Laos",2.5,6000,A287E328B1541DC7DB9F1B6556E6291C,Manichan Guesthouse,Luang Prabang,LA,Ban Pakham Unit 4/143,2,60000
51F67FDE61BD25FE68F2ED7133B180EF,Lugogo Sun Hotel,Mbabane,SZ,Old Mbabane/Manzini Main Road Ezulwini Valley,3,,50871D783E46D0946EF884AFBEAE6D1C,Lugogo Sun,Ezulwini,SZ,"Old Mbabane/Manzini Main Road, Ezulwini Valley",3,H100
F873E896477CDDEF43E8DA5E20B0A1D8,ibis Moscow Centre Bakhrushina,Moscow,RU,Bakhrushina street 11,3,115054,CA36ED25EE48073466AF5C69F4FCCD71,Ibis Moscow Centre Bakhrushina,Moscow,RU,Ulitsa Bakhrushina 11,3,115184
1C9BE277F4054EFE747F73D4A63CD460,Villa Moonshadow,Samui,TH,"104/28 Moo 3, Chaweng Noi, T. Bophut",5,84320,25E7C4234BB032E27D4270C0E1167A44,Villa Moonshadow - Award Winning Villa,Chaweng Noi Beach,TH,104/28 Moo 3  Thambon Bophut Koh Samui,5,84320
9819E17D6A230103C878BC66B40283E7,El Puerto Hotel,Kenting,TW,"No.252, Shadao Rd",3.5,946,4146361B6F08D1E6DE4C042F07AB7DBB,El Puerto Hotel,Eluan,TW,"No. 252, Shadao Road",0,946
FCBE5E6D6A9435AFAF82FAA646E0C2A0,Les Jardins de la Medina,Marrakech,MA,"21 Derb Chtouka, Kasbah",5,40000,B5915F4F81B58D9994E21D596C6D8CF5,Les Jardins De La Médina,Marrakech,MA,21 Derb Chtouka,5,40000
DE870BFF422239BE7D45B84AB4AD78C2,Baywatch Guest House,Paternoster,ZA,"6 Ambyl Road,Mosselbank",4,7381,AF2F89AA3087F393BED01FC8F77AA4E8,Baywatch Guest House,Paternoster,ZA,"6 Ambyl Road, Mosselbank",4,7381
EDEC2B92A289B73B9780AB4D6A935ED0,Cheviot Hotel,Bellingham,GB,Main Street,3,NE48 2AU,1481B759A71450FD550A011959D2DCDF,The Cheviot Hotel,Bellingham,GB,Main Street,0,NE48 2AU
F3620F77F1F269327EA2706C62B56AD5,Sunny A Hotel,Hue,VN,17/34 Nguyen Tri Phuong Street,2,,BCA8242A8F5258959252E96BB0B377E2,Sunny A Hotel,Hue,VN,17/34 Nguyen Tri Phuong,2,
D5FBD81BB1636A03A70A713B2822B63C,West Hotel,Dubai,AE,"Naif Road, Naif, Deira, Opposite Naif Park P.O.Box: 1039, Dubai",1,1039,54FEFDA0485D19ECC4756C6D6FBCA733,West Hotel,Dubai,AE,"Naif Road, Deira, Dubai",1,
29302DD44DED389E506F123F1CF4776D,Ethnotel,Kolkata,IN,"71/1,Jessore Road, Opp Airport 2.5 No Gate",3,700081,0C6D7304DE2A7696505D08EA069E6534,Ethnotel,Kolkata,IN,"71/1, Jessore Road,Near Netaji Subhas Chandra Bose International Airport ",0,700081
38DB5BE525CB7071F9EAC9509EDE159D,AC Hotel by Marriott Paris Le Bourget Airport,Garges-les-Gonesse,FR,2 Rue de la Haye,4,93440,C0B0B31137D36B8B4B4D39243C666348,AC Hotel Paris Le Bourget Airport,Le Bourget,FR,2 Rue de la Haye,4,93440
77B35A0FDE68A589BC94CBC78D001E31,Hotel Vikrant - Kullu,Manali,IN,"Behind H.P. Tourism Office, Dhalpur, Kullu",2.5,175101,05EA544CA9B5F7CB559AF011820854CF,Hotel Vikrant,Kulu,IN,"Behind H.P. Tourism Office, Dhalpur",1,175101
464E7B110119E213BF4B52B03ACE24F3,Subang Valley Hotel,Kuala Lumpur,MY,"No 1, Jalan SS 15/5A",1,47500,1AE2820C148AA9479397AEF707BAF611,Subang Valley,Subang Jaya,MY,"1, Jalan SS15/5A",0,47500
FF50E894FBFB60B7C2E9CBA5F5AF30E4,Hanting Hotel Shenzhen Mix City,Shenzhen,CN,No 4023 Jiabin Road,2,518010,738CCFF3D4949F64844FB7AF2AB4C9EE,Hanting Express Shenzhen Wanxiang Mall,Shenzhen,CN,"4023, Jiabin Road, Luohu District, Shenzhen, Guangdong",2,518010
3B4CC9B6F0B89B2994F623F36D14CD96,Hanting Hotel Yiwu Binwang Branch,Yiwu,CN,"No.134,Che Zhan Lu",2,322000,EA5E201AFE5E83153F85548E50EC0BC1,Hanting Express Yiwu Bing wang,Yiwu,CN,No.134 Chen Zhan Road,2,322000
B0686A7F74C7C721FA69FC95D660EC1B,Hi Inn Shenzhen Huaqiang Branch,Shenzhen,CN,"Building D Huaqiang Garden, Fuhong RD,Futian District",2,,C28E92052F933EAAB3555895A036CFAA,Hi Inn Shenzhen Huaqiang,Shenzhen,CN,"Building D, Huaqiang Garden, Fuhong Road, Futian District, Shenzhen",0,518033
31CE397B88164346D4E3D6BD1503463F,Anchor On Collins Sapphire,Melbourne,AU,368 Little Collins Street,4,3000,20C47504CE09710CF6ED50EB604922D6,Anchor on Collins Sapphire,Melbourne,AU,368 Little Collins Street,0,3000
388A51D5861FAAA0C740D79E78FD11BD,Parinyas Apartment,Pattaya,TH,"316/144 M.10 Soi Buakhao, Pattaya, Nongprue Banglamung",3,20150,B6A388ACF97E18A3ACC25B2423B74242,Parinya's Apartment,Pattaya Central,TH,316/144 M.10 Buakhao Rd Nongprue Banglamung Chonburi,0,20150
92D7B7D355967300BAB1427F0BFF968C,Jinjiang Inn Yixing Middle Renming Road,Wuxi,CN,No.238 Middle Renming Road,2,214200,FCCAD06F308DFB78220D3F15C8464097,Jinjiang Inn Yixing Middle Renmin Road Pedestrain,Yixing,CN,No.238 Middle Renmin Road,3,214200
FBF22C4E7B7D8B018A2113C5210D974B,Yangsho Sunvalley Hotel,Yangshuo,CN,"No. 61 Pantao Street, Yangshuo County",2,541990,A77CE5FDC40490907152A3912CCF2788,Yangshuo 520 Dream Hostel,Yangshuo,CN,No.61 Shengxian Road,0,541900
2B220E038BB3612473678A87DE98FE0E,Govindam Resort,Pushkar,IN,"Jaipur By pass road, Village Nedliya Near Chungi Naka,",3,305022,E047CEA121C05F4FA2282DEC80437AB6,Govindam Resort,Pushkar,IN,"Jaipur By Pass Road, Village Nedliya, Near Chungi Naka",0,305022
AA87F35726F472DCD60F25DFDB38E75D,Ocean Park Boutique Hotel,Sihanoukville,KH,"28 Mithona Street, Mondol1, Sangkat3",3,,DAA4B466D56B5EC2838ED997CFD66CA9,Ocean Park Boutique Hotel,Phumĭ Poŭthĭ Té,KH,"Sangkat 3, Mondol 1, Khan Mittapheap,",3,
33EE9CC6CF1F2B0FCB038167423E898E,GreenTree Inn Jiangxi Yingtan Jiaotong Road Central Square Business Hotel,Yingtan,CN,"25 Jiaotong Road, Yue Hu District",3,335000,DA405528B04756AAA8E8D6049C3639CA,GreenTree Inn Jiangxi Yingtan Jiaotong Road Central Square Business Hotel,Yingtan,CN,"No.25, Jiaotong Road, Yuehu District",2,335000
A618A3F5BAB56BA99A369F0AC9296828,Cha-Am Pool Station,Hua Hin / Cha-am,TH,327/37 cha-am hua hin,3,77110,5CDD200DE24B52291DD9EB32DDE05AE1,Cha-am Pool Station,Cha Am,TH,"327/37 Nong Chaeng Alley, Cha-am District, Phetchaburi",0,76120
129A801876B5F48D60EDD57D726196FD,Private Bungalow In Mauritius,Mauritius Island,MU,"B59, Coastal Road, Belle Mare",5,,CB217ED44AD8B972A3E7E92559B17ABD,Belle Mare Beach Bungalow,Belle Mare,MU,"Coastal Road, B59, Quatre Cocos",0,
7240F1EDE311114DEC209632543888BF,Hotel Seri Malaysia Kuala Terengganu,Kuala Terengganu,MY,"Lot 1640, Jalan Hiliran, (Balik Bukit), Terengganu",2,20100,64734871117215E08A3D8B157D6C2630,Hotel Seri Malaysia Kuala Terengganu,Kuala Terengganu,MY,"Lot 1640, Jalan Hiliran, (Balik Bukit)",3,20100
1CD4C9CF8A406CE138011F4DE03FCC9A,Vista Rooms near Nectar Garden,Hyderabad,IN,"Hallmark Hospitality Services, Plot No 8, 1-89/C/8, Beside Colours & Flavours, Durgam Cheruvu Road Near Nector Gardens Madhapur hyd 500081",3,500081,3AF91C42228D63E8F273D922441AA3D5,Vista Rooms near Nectar Garden,Hyderabad,IN,"Hallmark Hospitality Services,Plot No 8, 1-89/C/8, Beside Colours & Flavours, Durgam Cheruvu Road Near Nector Gardens Madhapur hyd 500081",0,500081
BD78BF105710FEB2A4B5722E0C9F11EA,First Floor Guesthouse,Ipoh,MY,Persiaran Lapangan Siber,0,31350,7476FA4C267C15A743A98629A9D99C35,First Floor Guesthouse,Ipoh,MY,"52A, Jalan Lapangan Suria, Medan Lapangan Suria",0,31350
74ACA51F73C9E2786A6A32139DB16E3D,Don Chan Residence,Chiang Mai,TH,"56 Moo 4 Tambon Tasala , A.muang . Chiang Mai",2.5,50000,BE9028083FEC2F0AA245DC53E38C5B39,Donchan Residence,Chiang Mai,TH,"56, Moo 4, Tambon Tasala, A.Muang, Chiang Mai",3,50000
A735B5B9AF9C50DA10258315304733CF,come inn2,Kenting,TW,"No.226, Henggong Rd.",2.5,946,2C3CD821672D8F4761720836B2658098,Kenting Come Inn2,Hengchun Old Town,TW,"No. 226, Henggong Road",0,946
9F6ABA0F3F6E30E0EED2FE3A0F8A69E7,Queen Shin Saw Pu Hotel,Yangon,MM,Shin Saw Pu,2,,BA61E1F793BC6818F34CC1CA1C002559,Queen Shin Saw Pu Hotel,Yangon,MM,"No. 39, Shin Saw Pu Road, Sanchaung Township",2,11221
0C72B8E30B14CEB0DCF7EE744668A8B5,Kronenhoff Guesthouse,Addo,ZA,1 Sonop Street Kirkwood,4,6120,6290E2147F11696464441C57A13891FD,Kronenhoff Guesthouse,Kirkwood,ZA,"1 Sonop Street, Kirkwood",4,6120
F49F38B6843FDFDCD68FF9B100846E54,Link Mansion,Chiang Mai,TH,115/19 Moo 2 Photharam Road,2.5,50300,E34D0CC4418DE76157BB4AB5821FA29E,Link Mansion,Chiang Mai,TH,"115/19 Moo2, Photharan Rd. T.Chang Phuak, A.Meung",2,50300
7059A2D0EBA7ECD222956A2983B6C15C,Imperial Hotel Hue,Hue,VN,8 Hung Vuong Street,5,,3F1361583A55651E63595F557CE8EA6B,Imperial Hue Hotel,Hue,VN,8 Hung Vuong Boulevard,5,
4CBBCD96FB8B6CD4BC257D5C04CA9C8D,Second Home Dormitory,Bangkok,TH,"163-165 changkraphong rd., pranakron chanasrongkram bangkok",2,10200,3663739FFC11F9FB74EE9331B7A29548,Second Home Dormitory,Bangkok,TH,"163-165 Jakapong Road, PhraNakhon, Taladyod",0,10200
2E3D2C4F33A7A1F58BC6C81CACD21E9C,Copenhagen Plaza Hotel,Copenhagen,DK,Bernstorffsgade 4,4,DK- 1577,D947C9CA81CEF801CD8CD633C0E9B483,Copenhagen Plaza,Copenhagen,DK,Bernstorffsgade 4,4,DK-1577
375FCE96128E183EBF6CAC73968ECEBF,Ciputra Golf Club & Hotel,Surabaya,ID,"Jl.Citraland Utama, Citraland",4,60219,245AE6B7CA32B2C2B8B3B46EC7FA6AC8,"Ciputra Golf, Club & Hotel",Surabaya,ID,"Citra Raya Utama, Citra Raya",3,60219
6809E95178D3BAE3B02D7270EDC94F38,Lindner Hotel and Spa Ruegen,Trent,DE,17 Vaschvitz Str.,4,18569,EF7DB75E56EF7972AF70C3900D2174FA,Lindner Hotel & Spa Rügen,Trent,DE,Vaschvitz 17,4,18569
0145EDB826E9906388A42B22E5E200AF,Hotel Re Pearl's Hill,Singapore,SG,175A Chin Swee Road,4,169879,BE419CDF098BAE8C8530EA4F19AF3837,Hotel Re! @ Pearl's Hill,Singapore,SG,175A Chin Swee Road,4,169879
DC6325C18C40DCDB28A14B31DCC39B35,Petersons Armidale Winery & Guesthouse,Armidale,AU,345 Dangarsleigh Rd,4.5,2350,F6666D2343F5CC1074612444C1EF5FCF,Petersons Armidale Winery and Guesthouse,Armidale,AU,345 Dangarsleigh Road,4,2350
B156AC971AD2DDF359C18B9D3551FA9D,Smile Inn,Bangkok,TH,136-138 Damrongrak Road (Opposite Sitaram Temple),2.5,,F3B46D79FB24C9EA003E3DBB5C67C3DF,Smile Inn,Bangkok,TH,"136-138 Damrongrak Road, Pom Prap Sattru Phai (Soi Trok Kee Thao, Behind Bo Bae Tower)",2,10100
F32726C28E70AAA1FB850DD8AB6FF7C6,Best Western University Inn at Valparaiso,Valparaiso (IN),US,760 Morthland Drive,3,46385-6260,409F1CD83716E8B77445C34DF96AC3BA,Best Western University Inn at Valparaiso,Valparaiso,US,760 Morthland Drive,2,46385
07A214D168F5CBB555DF2A8DDD5702C4,Aspasios Arago Executive Apartments,Barcelona,ES,"Arago, 155",0,8011,EFE6116ECAC0D5CF400DD9E8BB2193B1,AB Aragó Executive Suites,Barcelona,ES,"Aragó, 155",0,8011
B999CF9926248CE0549D2AA3F3BE1885,Somersal Bed and Breakfast - Wedding Venue,Waitomo,NZ,"1724 McClure Street, RD6, Te Awamutu",4,3876,89EE54C6368753CC6560C3BCC0048597,Somersal Bed & Breakfast,Pirongia,NZ,1724 McClure Street,4,3876
3225D37B323586B2A1121EBD8512E85D,Windradyne Boutique Bed & Breakfast,Blue Mountains,AU,"6 Cliff Drive, Katoomba",4.5,,428476A0752DBFE8BC780083E088F388,Windradyne Boutique Bed & Breakfast,Katoomba,AU,6 Cliff Drive,4.5,2780
AE10BEA1B4CD167C35A5DAA1DFEABF97,Beach Huts Middleton,Victor Harbor,AU,1 Charles Street,3.5,5212,195F055A921CE68402A216E21C81D424,Beach Huts Middleton,Middleton,AU,1 Charles Street,3.5,5213
AE50CC0BF6EA43FFA12D714035BF6995,Best Western Inn,Monroeville (AL),US,4419 S Alabama Avenue,2,36460-5639,703192B8B7AA0B4CAE10BB94BA75EBE5,Best Western Inn Monroeville,Monroeville,US,4419 South Alabama Avenue,2,36460
8FFE4276672AA281C5B044D4392D7243,Villa Aqua,Sunshine Coast,AU,134 Gympie Terrace,4.5,4566,1623A912077194AF9F292CEBC7514600,Villa Aqua,Noosaville,AU,134-136 Gympie Terrace,4.5,4566
7D8FF801596F8DC6D7BD5BB464009163,The Pavilion Hotel,Sandakan,MY,"Block A3, Bandar Labuk Jaya, Mile 7, Labuk Road",3,90000,4907A03E78FE0A455D685B8EEFD053BE,The Pavilion Hotel,Sandakan,MY,"Block A3,Bandar Labuk Jaya, Mile 7, Labuk Road,",3,90000
45B9CC54FBC997DE1AC4C6C0DE3C0BEE,Best Western Harbour Inn and Suites,Sunset Beach (CA),US,16912 Pacific Coast Highway,3,90742,6EE4CD3E366BD9E7B975A1520D5BE6FB,Best Western - Harbour Inn & Suites,Huntington Beach,US,16912 Pacific Coast Highway,3,90742
3C6B5DE671C25388C893B74BDD3AC9C0,Asahikawa Sun Hotel,Asahikawa,JP,"7-8 Nijodori,",2.5,070-0032,1A30E27AE2556A7B56A1294931365D92,Asahikawa Sun Hotel,Asahikawa,JP,Nijo-dori 7 Hidari 8,3,070-0032
7C2A30DA0C5452B8C35962FF9885CB44,Raoum Inn Arar,Arar,SA,Northern Borders,0,,26D8B199B47650E948F4AE36DFCBD9F7,Raoum Inn Arar,Arar,SA,Northern Borders ,0,
0A5524B224D2577BA05E7D7317486149,Camelot on Ulster,Hamilton,NZ,"231 Ulster Street, Whitiora",4,3200,8DC6D568E26094F2D8571608FA38CA91,Camelot On Ulster,Hamilton,NZ,231 Ulster Street,4.5,3200
D9FB7ADA330B23E929D99A15E301AD37,B & B Matinee,Mattinata,IT,100 Corso Matino,0,71030,BB03E293FFCE552FE294332B436DB1A1,B&B Matinèe,Mattinata,IT,Corso Matino 100,0,71030
0BA3FE48D5AB5FCFB4743186C725CEF9,Hampton Inn Kansas City - Liberty Hotel,Kansas City (MO),US,8551 North Church Road,3,64158,9304E840061F69214EA586AC8C0C7C65,Hampton Inn Kansas City Liberty,Liberty,US,8551 North Church Road,3,64158
485DF895AB98B8336A918E0ABF6DC883,Casa D' Estrella Apartelle,Boracay Island,PH,Boat Station 2,1.5,5608,029CAE5D0A432F0E0EBF20714ECF0015,Casa D' Estrella Apartelle,Boracay,PH,Balabag,2,5608
2919EEB3C6714BF944F4332BDAE5735A,Hilton Garden Inn Omaha Downtown Old Market Area,Omaha (NE),US,1005 Dodge Street,3,68102,F65585815AF3EC9C0D394E3CF58488F1,Hilton Garden Inn Omaha Downtown-Old Market Area,Omaha,US,1005 Dodge Street,3,68102
74E0DED2058867CBC15859BC41877C1F,Golden Hopes Group Of Houseboats,Srinagar,IN,Nehru Park Dal Lake Gate No. 14 behind Hotel Leeward,3,190001,078B1C405060ADDCA7D67506CC6DFE4A,Golden Hopes Group of Houseboats,Srinagar,IN,"Nehru Park, Gate No 14, Behind Hotel Leeward",3,190001
837009F7C77EB46968D77F95D00A1ED7,Comfort Inn Hotel Sherbrooke,Sherbrooke (QC),CA,4295 boul. Bourque,3,J1N 1S4,FF8D9FEE05E6C18C987F61CCAC7537F4,Comfort Inn Sherbrooke,Sherbrooke,CA,4295 Boulevard Bourque,3,J1N 1S4
